Дата,Время начала,Время окончания,Длительность,Задача,Статус
2026-03-04,14:06,14:07,1 мин,"Проверка доступа к макету Figma",Выполнено
2026-03-04,14:07,14:15,8 мин,"Изменение хедера на странице About (перенос вверх)",Выполнено
2026-03-04,14:15,14:18,3 мин,"Детальная стилизация хедера (pixel perfect) по Figma",Выполнено
2026-03-04,14:18,14:18,0 мин,"Корректировка отступа между кнопками в хедере (35px)",Выполнено
2026-03-04,14:18,14:20,2 мин,"Стилизация кнопки 'Увійти' (градиент)",Выполнено
2026-03-04,14:20,14:22,2 мин,"Стилизация текста кнопки 'Увійти' (шрифт, размер)",Выполнено
2026-03-04,14:22,14:24,2 мин,"Стилизация кнопки 'ПРОЙТИ ТЕСТУВАННЯ' по схеме",Выполнено
2026-03-04,14:24,14:26,2 мин,"Фиксация ширины кнопки 'ПРОЙТИ ТЕСТУВАННЯ' (227px)",Выполнено
2026-03-04,14:26,14:28,2 мин,"Приведение кнопки 'Увійти' в точное соответствие макету (padding, radius, border)",Выполнено
2026-03-04,14:28,14:30,2 мин,"Стилизация навигационных ссылок (шрифт, размер, отступы) по макету",Выполнено
2026-03-04,14:30,14:30,0 мин,"Корректировка отступа между ссылками меню (68px)",Выполнено
2026-03-04,14:30,14:32,2 мин,"Стилизация логотипа (размер 187x60px)",Выполнено
2026-03-04,14:32,14:35,3 мин,"Адаптация страницы About под разные размеры экрана (flexbox)",Выполнено
2026-03-04,14:35,14:39,4 мин,"Исправление локализации страницы About (синхронизация с хедером)",Выполнено
2026-03-04,14:39,14:44,5 мин,"Верстка нового баннера на странице About (слева/справа картинки, центр контент)",Выполнено
2026-03-04,14:44,14:46,2 мин,"Корректировка размера заголовка PSY MI на баннере (547x103px)",Выполнено
2026-03-04,14:46,14:48,2 мин,"Тонкая настройка стилей заголовка PSY MI (расстояние, цвет)",Выполнено
2026-03-04,14:48,14:50,2 мин,"Увеличение отступа между словами PSY и MI (space-between)",Выполнено
2026-03-04,14:50,14:52,2 мин,"Корректировка отступа между PSY и MI (уменьшение, gap: 20px)",Выполнено
2026-03-04,14:52,14:54,2 мин,"Растягивание боковых картинок баннера на всю ширину экрана",Выполнено
2026-03-04,14:54,14:56,2 мин,"Стилизация подзаголовка 'ІННОВАЦІЙНА ПСИХОЛОГІЧНА ПЛАТФОРМА' по макету",Выполнено
2026-03-04,14:56,14:58,2 мин,"Фиксация размера заголовка PSY MI (547x103px) с justify-content: space-between",Выполнено
2026-03-04,14:58,15:00,2 мин,"Откат изменений заголовка PSY MI (возврат к gap: 20px)",Выполнено
2026-03-04,15:00,15:03,3 мин,"Точное позиционирование заголовка PSY MI (547x103px, margin-left: 228px)",Выполнено
2026-03-04,15:03,15:05,2 мин,"Настройка размеров и позиции робота (283x372px, top: 76px, left: 997px)",Выполнено
2026-03-04,15:05,15:08,3 мин,"Восстановление видимости робота (z-index, relative container)",Выполнено
2026-03-04,15:08,15:09,1 мин,"Сдвиг робота вправо на 50px (left: 1047px)",Выполнено
2026-03-04,15:09,15:10,1 мин,"Установка фиксированной высоты баннера (406px)",Выполнено
2026-03-04,15:10,15:11,1 мин,"Уменьшение размеров робота на 50px (233x322px)",Выполнено
2026-03-04,15:11,15:12,1 мин,"Сдвиг робота вправо еще на 50px (left: 1097px)",Выполнено
2026-03-04,15:12,15:13,1 мин,"Сдвиг робота вправо еще на 50px (left: 1147px)",Выполнено
2026-03-04,15:13,15:14,1 мин,"Сдвиг робота вниз на 10px (top: 86px)",Выполнено
2026-03-04,15:14,15:15,1 мин,"Сдвиг робота вниз еще на 10px (top: 96px)",Выполнено
2026-03-04,15:15,15:16,1 мин,"Сдвиг контента баннера влево на 100px (margin-left: 128px)",Выполнено
2026-03-04,15:16,15:18,2 мин,"Стилизация блока описания (padding 14px 21px, radius 13px, blur, font 18px)",Выполнено
2026-03-04,15:18,15:19,1 мин,"Обновление текста описания баннера (UA)",Выполнено
2026-03-04,15:19,15:20,1 мин,"Стилизация текста описания (Unbounded, 17px, 400, width 781px)",Выполнено
2026-03-04,15:20,15:23,3 мин,"Реорганизация секции 'НАМ ДОВІРЯЮТЬ' (логотипы в один ряд)",Выполнено
2026-03-04,15:23,15:24,1 мин,"Установка высоты секции 'НАМ ДОВІРЯЮТЬ' (143px)",Выполнено
2026-03-04,15:24,15:25,1 мин,"Стилизация заголовка 'НАМ ДОВІРЯЮТЬ' (Montserrat, 40px, Bold)",Выполнено
2026-03-04,15:25,15:26,1 мин,"Центрирование контента секции 'НАМ ДОВІРЯЮТЬ' (100vw, align-items: center)",Выполнено
2026-03-04,15:26,15:27,1 мин,"Сдвиг заголовка 'НАМ ДОВІРЯЮТЬ' влево на 50px",Выполнено
2026-03-04,15:27,15:28,1 мин,"Сдвиг заголовка 'НАМ ДОВІРЯЮТЬ' влево еще на 50px (total -100px)",Выполнено
2026-03-04,15:28,15:29,1 мин,"Сдвиг заголовка 'НАМ ДОВІРЯЮТЬ' вправо на 20px (total -80px)",Выполнено
2026-03-04,15:30,15:40,10 мин,"Стилизация секции 'Про платформу' (высота 413px, 2 колонки)",Выполнено
2026-03-04,15:40,15:42,2 мин,"Замена изображения в секции 'Про платформу' на голубое (img1.svg)",Выполнено
2026-03-04,15:42,15:45,3 мин,"Корректировка ширины секции 'Про платформу' (1117px -> 1220px)",Выполнено
2026-03-04,15:45,15:47,2 мин,"Выравнивание заголовка 'НАМ ДОВІРЯЮТЬ' по центру",Выполнено
2026-03-04,15:47,15:52,5 мин,"Обновление текстов секции 'Про платформу' по скриншоту",Выполнено
2026-03-04,15:52,15:55,3 мин,"Добавление анимации (всплытие, hover, блик) для карточек логотипов",Выполнено
2026-03-04,15:55,15:58,3 мин,"Изменение анимации карточек (эффект нажатия клавиш без блика)",Выполнено
2026-03-04,15:58,16:00,2 мин,"Удаление анимации появления (fadeInUp) для исправления конфликта с hover",Выполнено
2026-03-04,16:00,16:03,3 мин,"Настройка автоматической анимации 'нажатия клавиш' для карточек логотипов",Выполнено
